product_name,product_rank
"360 Wireless Security Camera 1080P for Home Surveillance with Two Way Audio, Pan Tilt and Phone APP from DEATTI",17
"DADYPET Pet Camera, Baby Monitor, WiFi Camera, 1080P FHD Wireless IP Security Home Dome Camera with Night Vision/Two-Way Audio/Cloud Storage/Motion Detection",11
"DOGNESS Automatic WiFi Dog/Cat Smart Camera Feeder   6.5lbs Large Capacity App Control Food Dispenser with WiFi, Portion Control, Voice Recording,Timer Programmable",14
"Dog Camera, 1080P FHD Pet Camera, AVSTART Wireless Camera with AI Human Detection, Night Vision, Home Security Camera 2-Way Audio, Pan/Tilt/Zoom WiFi IP Camera Works with Alexa, Cloud Storage/TF Card",12
"Furbo Dog Camera: Treat Tossing, Full HD Wifi Pet Camera and 2-Way Audio, Designed for Dogs, Compatible with Alexa (As Seen On Ellen)",1
HD 1080p Pet Camera Dog Camera 360° Pet Monitor Indoor Cat Camera with Night Vision and Two Way Audio,13
IMILLET WiFi Pet Camera Dog Camera with Phone App FHD Indoor Cat Camera Pet Monitor Night Vision 2 Way Audio Motion Detection (Black),6
"Iseebiz Smart Pet Camera, Dog Camera Treat Dispenser, 2-Way Audio, 720P Night Vision Camera, App Control(Android/iOS) Treat Tossing, 2.4G Wifi Enable, Compatible with Alexa, Monitor Your Dogs and Cats",18
NPET Smart Pet Camera Dog Treat Dispenser,15
"Owlet Home | Pet Camera with Treat Dispenser &amp; Tossing for Dogs/Cats, WiFi, 720P Camera, Live Video, Auto Night Vision, 2-Way Audio, Work with Alexa",19
"Pet Camera, VSTARCAM Dog Camera with Laser Wireless Cat Camera 1080P Baby Monitor Camera with 2 Way Audio, Night Vision Sound Motion Alerts, APP Remote Control Home Security Camera for Pet &amp; Baby",7
"PetChatz HDX: [New] USA Made Luxury 2-Way Audio &amp; Video Pet Treat Camera, HD 1080p, Motion/Sound Detection Smart Video Recording, Streams DOGTV, Calming Aromatherapy, Designed for Dogs and Cats",20
RV/Dog Safety Temperature &amp; Humidity Sensor | 4G Verizon Cellular | Wireless Remote Pet Temp Monitor with 24/7 Email/SMS Alerts | No WiFi Required | iOS/Android Compatible,8
"SKYMEE Dog Camera Treat Dispenser,WiFi Full HD Pet Camera with Two-Way Audio and Night Vision,Compatible with Alexa",10
TOOGE Pet Dog Camera Wireless Home Security Camera FHD WiFi Indoor Camera Pet Monitor Cat Camera Night Vision 2 Way Audio and Motion Detection,2
"W.C Redmon Precision Digital Pet Scales, Large",4
"WOpet Smart Pet Camera:Dog Treat Dispenser, Full HD WiFi Pet Camera with Night Vision for Pet Viewing,Two Way Audio Communication Designed for Dogs and Cats,Monitor Your Pet Remotely",5
"[New 2020] Petcube Bites 2 Wi-Fi Pet Camera with Treat Dispenser &amp; Alexa Built-in, for Dogs and Cats. 1080p HD Video, 160° Full-Room View, 2-Way Audio, Sound/Motion Alerts, Night Vision, Pet Monitor",9
"[New 2020] Petcube Cam Pet Monitoring Camera with Built-in Vet Chat for Cats &amp; Dogs, 1080p HD Video, Night Vision, Two-Way Audio, Magnet Mounting, Home Security",3
"[New 2020] Petcube Play 2 Wi-Fi Pet Camera with Laser Toy &amp; Alexa Built-In, for Cats &amp; Dogs. 1080P HD Video, 160° Full-Room View, 2-Way Audio, Sound/Motion Alerts, Night Vision, Pet Monitoring App",16
